{
  "schemaVersion": 1,
  "kind": "dustin-close-plan",
  "network": {
    "passphrase": "Test SDF Network ; September 2015",
    "horizon": "https://horizon-testnet.stellar.org"
  },
  "account": "GBLXGTTPY2ZU64A53ZCANIX7ZFLXMHI6KSGRCPKSY5ORZAFEHUU3YMOK",
  "destination": "GBR3YSAJB5V75OA377G54DABNPO65I5IUHUW24C7QFFDOD2DDER42UJQ",
  "feeSponsor": "GCBW3VNCN7IYREOZIJ7LFC5TCRK3O6E4K7TK3WGY2KK6AARIOYFC6O6I",
  "memo": null,
  "options": {
    "slippageBps": 100,
    "maxOpsPerTransaction": 100,
    "maxWaitLedgers": 120
  },
  "observed": {
    "ledger": 5158335,
    "closedAt": "2026-10-12T14:27:42Z"
  },
  "reserve": {
    "balance": "4.0000000",
    "baseReserve": "0.5000000",
    "minimum": "4.0000000",
    "spendable": "0.0000000"
  },
  "snapshotHash": "441f1f1b826d927441eaa4aad551a04b3252d79f41228d919de3edbd122a4631",
  "ladderOrder": "sow",
  "status": "closable",
  "steps": [
    {
      "id": "S01",
      "kind": "cancel_offer",
      "txIndex": 0,
      "subject": {
        "type": "offer",
        "offerId": "912364",
        "selling": {
          "type": "credit_alphanum12",
          "code": "DUSTA",
          "issuer": "GC5YET2PKQP7WCEQWOP4ASBJHW3I5JN2KUMWOVQMUGPL2Q6UX44PW3EM"
        },
        "buying": {
          "type": "native"
        },
        "amount": "0.0000002"
      },
      "reason": "Open offer 912364 sells 0.0000002 DUSTA for XLM. Offers are subentries that block the merge, and their liabilities stop the balance from moving and the trustline from being removed; it is cancelled with amount 0.",
      "threshold": "medium",
      "operation": {
        "type": "manageSellOffer",
        "offerId": "912364",
        "selling": {
          "type": "credit_alphanum12",
          "code": "DUSTA",
          "issuer": "GC5YET2PKQP7WCEQWOP4ASBJHW3I5JN2KUMWOVQMUGPL2Q6UX44PW3EM"
        },
        "buying": {
          "type": "native"
        },
        "amount": "0",
        "price": {
          "n": 100,
          "d": 1
        }
      },
      "feeEstimateStroops": 32157,
      "dependsOn": []
    },
    {
      "id": "S02",
      "kind": "cancel_offer",
      "txIndex": 0,
      "subject": {
        "type": "offer",
        "offerId": "912365",
        "selling": {
          "type": "credit_alphanum12",
          "code": "DUSTC",
          "issuer": "GC5YET2PKQP7WCEQWOP4ASBJHW3I5JN2KUMWOVQMUGPL2Q6UX44PW3EM"
        },
        "buying": {
          "type": "credit_alphanum12",
          "code": "DUSTB",
          "issuer": "GC5YET2PKQP7WCEQWOP4ASBJHW3I5JN2KUMWOVQMUGPL2Q6UX44PW3EM"
        },
        "amount": "0.0000002"
      },
      "reason": "Open offer 912365 sells 0.0000002 DUSTC for DUSTB. Offers are subentries that block the merge, and their liabilities stop the balance from moving and the trustline from being removed; it is cancelled with amount 0.",
      "threshold": "medium",
      "operation": {
        "type": "manageSellOffer",
        "offerId": "912365",
        "selling": {
          "type": "credit_alphanum12",
          "code": "DUSTC",
          "issuer": "GC5YET2PKQP7WCEQWOP4ASBJHW3I5JN2KUMWOVQMUGPL2Q6UX44PW3EM"
        },
        "buying": {
          "type": "credit_alphanum12",
          "code": "DUSTB",
          "issuer": "GC5YET2PKQP7WCEQWOP4ASBJHW3I5JN2KUMWOVQMUGPL2Q6UX44PW3EM"
        },
        "amount": "0",
        "price": {
          "n": 1,
          "d": 1
        }
      },
      "feeEstimateStroops": 32157,
      "dependsOn": []
    },
    {
      "id": "S03",
      "kind": "dispose_balance",
      "txIndex": 0,
      "subject": {
        "type": "trustline",
        "asset": {
          "type": "credit_alphanum12",
          "code": "DUSTB",
          "issuer": "GC5YET2PKQP7WCEQWOP4ASBJHW3I5JN2KUMWOVQMUGPL2Q6UX44PW3EM"
        },
        "balance": "0.0000003",
        "sponsor": null
      },
      "threshold": "medium",
      "disposal": {
        "rung": "return_to_issuer",
        "amount": "0.0000003",
        "to": "GC5YET2PKQP7WCEQWOP4ASBJHW3I5JN2KUMWOVQMUGPL2Q6UX44PW3EM",
        "fallbackRungs": [],
        "ruledOut": [
          {
            "rung": "path_payment",
            "reason": "Horizon found no strict-send path to XLM for the full balance"
          },
          {
            "rung": "send_to_destination",
            "reason": "the destination holds no DUSTB trustline"
          }
        ]
      },
      "feeEstimateStroops": 32157,
      "reason": "Horizon found no strict-send path to XLM for the full balance. Pay the 0.0000003 DUSTB back to its issuer GC5YET2PKQP7WCEQWOP4ASBJHW3I5JN2KUMWOVQMUGPL2Q6UX44PW3EM, which burns it.",
      "operation": {
        "type": "payment",
        "destination": "GC5YET2PKQP7WCEQWOP4ASBJHW3I5JN2KUMWOVQMUGPL2Q6UX44PW3EM",
        "asset": {
          "type": "credit_alphanum12",
          "code": "DUSTB",
          "issuer": "GC5YET2PKQP7WCEQWOP4ASBJHW3I5JN2KUMWOVQMUGPL2Q6UX44PW3EM"
        },
        "amount": "0.0000003"
      },
      "dependsOn": [
        "S01",
        "S02"
      ]
    },
    {
      "id": "S04",
      "kind": "remove_trustline",
      "txIndex": 0,
      "subject": {
        "type": "trustline",
        "asset": {
          "type": "credit_alphanum12",
          "code": "DUSTB",
          "issuer": "GC5YET2PKQP7WCEQWOP4ASBJHW3I5JN2KUMWOVQMUGPL2Q6UX44PW3EM"
        },
        "balance": "0.0000003",
        "sponsor": null
      },
      "reason": "The DUSTB trustline is empty once the balance is disposed of; a trustline is a subentry that blocks the merge. Removing it (limit 0) releases its 0.5 XLM reserve to this account.",
      "threshold": "medium",
      "operation": {
        "type": "changeTrust",
        "asset": {
          "type": "credit_alphanum12",
          "code": "DUSTB",
          "issuer": "GC5YET2PKQP7WCEQWOP4ASBJHW3I5JN2KUMWOVQMUGPL2Q6UX44PW3EM"
        },
        "limit": "0"
      },
      "reserveReleasedTo": {
        "to": "account"
      },
      "feeEstimateStroops": 32157,
      "dependsOn": [
        "S03",
        "S02"
      ]
    },
    {
      "id": "S05",
      "kind": "dispose_balance",
      "txIndex": 0,
      "subject": {
        "type": "trustline",
        "asset": {
          "type": "credit_alphanum12",
          "code": "DUSTC",
          "issuer": "GC5YET2PKQP7WCEQWOP4ASBJHW3I5JN2KUMWOVQMUGPL2Q6UX44PW3EM"
        },
        "balance": "0.0000005",
        "sponsor": null
      },
      "threshold": "medium",
      "disposal": {
        "rung": "return_to_issuer",
        "amount": "0.0000005",
        "to": "GC5YET2PKQP7WCEQWOP4ASBJHW3I5JN2KUMWOVQMUGPL2Q6UX44PW3EM",
        "fallbackRungs": [
          "send_to_destination"
        ],
        "ruledOut": [
          {
            "rung": "path_payment",
            "reason": "Horizon found no strict-send path to XLM for the full balance"
          }
        ]
      },
      "feeEstimateStroops": 32157,
      "reason": "Horizon found no strict-send path to XLM for the full balance. Pay the 0.0000005 DUSTC back to its issuer GC5YET2PKQP7WCEQWOP4ASBJHW3I5JN2KUMWOVQMUGPL2Q6UX44PW3EM, which burns it.",
      "operation": {
        "type": "payment",
        "destination": "GC5YET2PKQP7WCEQWOP4ASBJHW3I5JN2KUMWOVQMUGPL2Q6UX44PW3EM",
        "asset": {
          "type": "credit_alphanum12",
          "code": "DUSTC",
          "issuer": "GC5YET2PKQP7WCEQWOP4ASBJHW3I5JN2KUMWOVQMUGPL2Q6UX44PW3EM"
        },
        "amount": "0.0000005"
      },
      "dependsOn": [
        "S01",
        "S02"
      ]
    },
    {
      "id": "S06",
      "kind": "remove_trustline",
      "txIndex": 0,
      "subject": {
        "type": "trustline",
        "asset": {
          "type": "credit_alphanum12",
          "code": "DUSTC",
          "issuer": "GC5YET2PKQP7WCEQWOP4ASBJHW3I5JN2KUMWOVQMUGPL2Q6UX44PW3EM"
        },
        "balance": "0.0000005",
        "sponsor": null
      },
      "reason": "The DUSTC trustline is empty once the balance is disposed of; a trustline is a subentry that blocks the merge. Removing it (limit 0) releases its 0.5 XLM reserve to this account.",
      "threshold": "medium",
      "operation": {
        "type": "changeTrust",
        "asset": {
          "type": "credit_alphanum12",
          "code": "DUSTC",
          "issuer": "GC5YET2PKQP7WCEQWOP4ASBJHW3I5JN2KUMWOVQMUGPL2Q6UX44PW3EM"
        },
        "limit": "0"
      },
      "reserveReleasedTo": {
        "to": "account"
      },
      "feeEstimateStroops": 32157,
      "dependsOn": [
        "S05",
        "S02"
      ]
    },
    {
      "id": "S07",
      "kind": "dispose_balance",
      "txIndex": 0,
      "subject": {
        "type": "trustline",
        "asset": {
          "type": "credit_alphanum4",
          "code": "SPTA",
          "issuer": "GC5YET2PKQP7WCEQWOP4ASBJHW3I5JN2KUMWOVQMUGPL2Q6UX44PW3EM"
        },
        "balance": "0.0000001",
        "sponsor": "GCO735NK5RUZWH25A3CKBROJOUPXKJPTQDXRJA7SWP5INVGCGMZWSBP4"
      },
      "threshold": "medium",
      "disposal": {
        "rung": "return_to_issuer",
        "amount": "0.0000001",
        "to": "GC5YET2PKQP7WCEQWOP4ASBJHW3I5JN2KUMWOVQMUGPL2Q6UX44PW3EM",
        "fallbackRungs": [],
        "ruledOut": [
          {
            "rung": "path_payment",
            "reason": "Horizon found no strict-send path to XLM for the full balance"
          },
          {
            "rung": "send_to_destination",
            "reason": "the destination holds no SPTA trustline"
          }
        ]
      },
      "feeEstimateStroops": 32157,
      "reason": "Horizon found no strict-send path to XLM for the full balance. Pay the 0.0000001 SPTA back to its issuer GC5YET2PKQP7WCEQWOP4ASBJHW3I5JN2KUMWOVQMUGPL2Q6UX44PW3EM, which burns it.",
      "operation": {
        "type": "payment",
        "destination": "GC5YET2PKQP7WCEQWOP4ASBJHW3I5JN2KUMWOVQMUGPL2Q6UX44PW3EM",
        "asset": {
          "type": "credit_alphanum4",
          "code": "SPTA",
          "issuer": "GC5YET2PKQP7WCEQWOP4ASBJHW3I5JN2KUMWOVQMUGPL2Q6UX44PW3EM"
        },